ID,Created,Name,Description,Playlist URL
750351fa296b463299607f8607a12830,2023-01-26T21:31:38Z,Forgotten 90s hits,"Maybe a one hit wonder, maybe just banger that didn't make it onto the right NOW mix. ",https://open.spotify.com/playlist/3pgk6mPc25V2Ibju8hAtNu
73aac5a9a008465880d9554c7a1a2f29,2023-01-26T21:31:38Z,Covers,Songs previously recorded by another artist,https://open.spotify.com/playlist/5kDq2Dx1CssldecdaTWHVF
1e381d90fd37422186f03f55f8abfee5,2023-01-26T21:31:38Z,Deep Cuts,Songs that are not well-known by artists who are very well-known,https://open.spotify.com/playlist/1b2FyO54E80OByHwG1Yplg
7d237a0b217c43aab145bc790726635d,2023-01-26T21:31:38Z,Early Days,Songs from famous bands that were released before they were well-known,https://open.spotify.com/playlist/47kcwRHcb2BML2j2TjCkqW
47f14e6b92a54d6792824933f4b9f207,2023-01-26T21:31:39Z,Slappin the drums,Songs featuring epic drum solos,https://open.spotify.com/playlist/1fkrQOokUtjAJo5PJtsvOs
8d42b211add24213b737cee5e62154fb,2023-01-26T21:31:39Z,We'll do it live!,Excellent live performances (excluding 50 Cents halftime show),https://open.spotify.com/playlist/5SSryxoLeblYgbbnZc0v3y
