ID,Created,Name,Description,Playlist URL
f228434448be434281377749971d4625,2023-04-06T13:27:54Z,"Fill my eyes, with that double vision ","1 song, 2 genres. Vote in pairs so make both versions count",https://open.spotify.com/playlist/50iyaIekLdbnan64X9ZZtG
ae9959191e394f2183feee969ca80595,2023-04-06T13:27:54Z,Happy Cuts!,Songs a mother (no one in particular) would want to head during a c section. ,https://open.spotify.com/playlist/4dLGFdhTNGI0LgPPdst6yb
cf841870b13e4e0383164ca93d017ab9,2023-04-06T13:27:54Z,Going the other way here,"Murder ballads, songs that tell a story about a murder or the reason for a murder as their core theme ",https://open.spotify.com/playlist/4LntMOUKbMrcTLf7vSBKfv
78b85d0390d34788b8ddb597ad7bc4e1,2023-04-06T13:27:54Z,Recency Bias,Songs from artists that debuted in the past 5 years. ,https://open.spotify.com/playlist/7ia49Q3LZcjsSmd16qAA47
acfa74aade3a4db4ba881dcabc17e231,2023-04-06T13:27:55Z,Unfortunate Jams,"Good songs by, as the youth would say, cring artists",https://open.spotify.com/playlist/6jLpm9dgHoqdsTpxzjo2iO
485da6ede92d478e837d326e39006ddd,2023-04-06T13:27:55Z,Jessie's Girl,"Songs that mention a Beth, Jennifer, Sarah, Megan, Sandy or Jackie. Spelling not important ",https://open.spotify.com/playlist/1FCM7FqFiPAve8HJN6jPjL
